Corbin	United States	Located near Early Addition St. There is a certain place in the road where people passing by will experience a strong sense of fear and the feeling that they are being watched. These feelings disappear quickly after they leave this one certain spot in the road. There have been no known reports of anything terrible having happened in the past to account for this haunting. -  February 2004 update / correction: The zone of fear is mainly experienced by pedestrians. It is a road with a lot of hills and curves and while the speed limit is posted as 15 mph, many people drive as fast as they can through this area just for fun. The submitter believes there have been a few accidents in the area but they don't have the facts with them. Could be more of an urban myth than anything else. A variation they’ve heard is that the area of fear lies off the road along the railroad tracks.	Florence Road	kentucky	KY	-84.0977963	36.9608502	-84.0968761	36.9486986	False	False	2008/02/26	wikipedia	13.3	11.5	Afternoon	Mist	Unknown	2008	True																																		North Corbin	36.96064	-84.09326	description					February 2004 (SpaCy_Score: 0.0000, Rule_Score: 0.4000)										15 mph (SpaCy_Score: 0.0000, Rule_Score: 0.4000)				haunting (SpaCy_Score: 0.0000, Rule_Score: 0.9000)														February 2004 (Score: 0.0000)	February 2004 (Score: 0.4000)																													15 mph (Score: 0.0000)	15 mph (Score: 0.4000)											haunting (Score: 0.0000)	haunting (Score: 0.9000)					"[{""text"": ""haunting"", ""label"": ""GHOST_TYPE"", ""start"": 364, ""end"": 372, ""spacy_score"": 1e-05, ""rule_score"": 0.9}, {""text"": ""February 2004"", ""label"": ""DATE"", ""start"": 377, ""end"": 390, ""spacy_score"": 1e-05, ""rule_score"": 0.4}, {""text"": ""15 mph"", ""label"": ""QUANTITY"", ""start"": 550, ""end"": 556, ""spacy_score"": 1e-05, ""rule_score"": 0.4}]"	[]
Covington	United States	The old theatre (and church) on Maine Strasse in Covington is frequented with glimpses of spectral figures in the corner of the eyes or in reflections, footsteps, light switches turn themselves on, and occasionally a loud noise as of something heavy being dropped to the ground and dragged across the floor on the ground level.	Old Theater	kentucky	KY	-84.50951380000001	39.0827166	-84.5085536	39.0836712	True	True	2025/02/26	wikipedia	13.3	11.5	Afternoon	Ghost Light	Supernatural Phenomenon	2025	False																																		Covington County	31.24849	-86.45125	description		Maine Strasse (SpaCy_Score: 0.0000, Rule_Score: 0.4000)	Covington (SpaCy_Score: 0.0000, Rule_Score: 0.4000)																					Maine Strasse (Score: 0.0000)	Maine Strasse (Score: 0.4000)		Covington (Score: 0.0000)	Covington (Score: 0.4000)																																																					"[{""text"": ""Maine Strasse"", ""label"": ""ORG"", ""start"": 32, ""end"": 45, ""spacy_score"": 1e-05, ""rule_score"": 0.4}, {""text"": ""Covington"", ""label"": ""GPE"", ""start"": 49, ""end"": 58, ""spacy_score"": 1e-05, ""rule_score"": 0.4}]"	[]
Crittenden	United States	There have been numerous occurrences there: hearing voices in the hallway, feeling something touching or grabbing your arm, seeing lights, a young woman twice and she almost instantly disappears.	Juvenile Detention Facility	kentucky	KY	-84.6057785	38.7985359	-84.6052206	38.7828437	True	False	2008/02/26	wikipedia	13.233333333333333	11.5	Unknown	Mist	Unknown	2008	True																																		Crittenden County	35.20794	-90.30886	description																																																																																	[]	[]
Cumberland	United States	Sounds of children running in the hallways, and the sounds of a child's laughter in the distance, slamming doors and lights turning off and on by themselves.	Benham Inn	kentucky	KY	-82.951123	36.96288	-82.9884955	36.9781475	True	False	2025/05/26	wikipedia		11.5	Morning	Unknown	Murder	2025	False																																		Cumberland County	40.16363	-77.26555	description																																																																																	[]	[]
Cumberland	United States	"Reports of an apparition of ""Headless Annie"" laying on the hood of a car when it stalls out, when she is gone, it starts back up."	Lynch Mountain	kentucky	KY	-82.929598	36.9675949	-82.9884955	36.9781475	False	True	2025/05/26	wikipedia	13.3	11.5	Unknown	Ghost	Unknown	2025	True																																		Lynch Mountain	36.9675949	-82.929598	original											Headless Annie (SpaCy_Score: 0.0000, Rule_Score: 0.4000)								apparition (SpaCy_Score: 0.0000, Rule_Score: 0.9000)																																Headless Annie (Score: 0.0000)	Headless Annie (Score: 0.4000)																							apparition (Score: 0.0000)	apparition (Score: 0.9000)					"[{""text"": ""apparition"", ""label"": ""GHOST_TYPE"", ""start"": 14, ""end"": 24, ""spacy_score"": 1e-05, ""rule_score"": 0.9}, {""text"": ""Headless Annie"", ""label"": ""WORK_OF_ART"", ""start"": 29, ""end"": 43, ""spacy_score"": 1e-05, ""rule_score"": 0.4}]"	[]
Cumberland	United States	It is believed that a little girl haunts this neighborhood. The people that live there tell at night they hear noises like someone trying to get into doors and windows. If you look out they say you can see where her mother hit her in the head with an axe. It is believed she is hunting the people who did not come to her rescue when her mother was doing this to her.	Power Street	kentucky	KY	-82.997427	36.976866	-82.9884955	36.9781475	True	False	1991/04/26	wikipedia	13.3	11.5	Afternoon	Unknown	Supernatural Phenomenon	1991	True																																		Power Street	36.976866	-82.997427	original																night (SpaCy_Score: 0.0000, Rule_Score: 0.4000)																																																		night (Score: 0.0000)	night (Score: 0.4000)														"[{""text"": ""night"", ""label"": ""TIME"", ""start"": 95, ""end"": 100, ""spacy_score"": 1e-05, ""rule_score"": 0.4}]"	[]
Cumbland Falls Saywer	United States	a while back a couple was getting married but their parents would not let them so they both jump off the bridge and you can see the woman’s ghost at night crying.	Cumbaland bridge	kentucky	KY	-84.3452147	36.8389703	-84.33861999999999	36.83866	False	True	2025/01/01	default	13.283333333333331	11.5	Afternoon	Ghost	Unknown	2025	True																																		Cumbaland bridge	36.8389703	-84.3452147	original																night (SpaCy_Score: 0.0000, Rule_Score: 0.4000)			ghost (SpaCy_Score: 0.0000, Rule_Score: 0.9000)																																															night (Score: 0.0000)	night (Score: 0.4000)								ghost (Score: 0.0000)	ghost (Score: 0.9000)					"[{""text"": ""ghost"", ""label"": ""GHOST_TYPE"", ""start"": 140, ""end"": 145, ""spacy_score"": 1e-05, ""rule_score"": 0.9}, {""text"": ""night"", ""label"": ""TIME"", ""start"": 149, ""end"": 154, ""spacy_score"": 1e-05, ""rule_score"": 0.4}]"	[]
Cullowhee	United States	8th Floor - In the early 1990's a young student hung herself in the East Wing. For many years the floor was shut off due to many occurrences with sightings of the young lady. Bathroom lights will turn on and off as well as doors opening and shutting. Water will run for no reason.	Scott Residence Hall	north carolina	NC	-83.18495449999999	35.30949390000001	-83.1765333	35.3137111	False	True	2025/01/02	wikipedia	13.333333333333334	11.533333333333331	Unknown	Unknown	Natural Disaster	2025	True																																		Scott Residence Hall	35.30949390000001	-83.18495449999999	original				the East Wing (SpaCy_Score: 0.0000, Rule_Score: 0.4000)	1990 (SpaCy_Score: 0.0000, Rule_Score: 0.4000), many years (SpaCy_Score: 0.0000, Rule_Score: 0.4000)																									the East Wing (Score: 0.0000)	the East Wing (Score: 0.4000)		1990 (Score: 0.0000), many years (Score: 0.0000)	1990 (Score: 0.4000), many years (Score: 0.4000)																																															"[{""text"": ""1990"", ""label"": ""DATE"", ""start"": 25, ""end"": 29, ""spacy_score"": 1e-05, ""rule_score"": 0.4}, {""text"": ""the East Wing"", ""label"": ""LOC"", ""start"": 64, ""end"": 77, ""spacy_score"": 1e-05, ""rule_score"": 0.4}, {""text"": ""many years"", ""label"": ""DATE"", ""start"": 83, ""end"": 93, ""spacy_score"": 1e-05, ""rule_score"": 0.4}]"	[]
Cullowhee	United States	"The Moore Building -  The Moore Building has many rumors around it regarding the haunting. The actual story is this: A young woman enrolled in the teaching program was murdered in the mid-sixties by a local resident when she refused his romantic advances. The man was caught, however, due to his mental capacity and well-respected family connections, he served only a few years at Broughton Hospital in Morganton. The 3rd floor began experiencing a haunting shortly after the girls' death. It is true that students began refusing to live on the 3rd floor due to the sounds of crying, screaming and pacing. Moore was converted to classrooms in the 1980's, yet strange things continued to happen. The man convicted of the girl's murder died in 1997, and the paranormal activity seems to have stopped, although students on the 3rd floor often report getting ""the creeps"" or feeling like they are being watched."	Western Carolina University	north carolina	NC	-83.18437809999999	35.3089224	-83.1765333	35.3137111	True	False	1997/01/01	description	13.316666666666666	11.533333333333331	Unknown	Unknown	Murder	1997	True																																		Western Carolina University	35.3089224	-83.18437809999999	original	Moore (SpaCy_Score: 0.0000, Rule_Score: 0.4000)		Morganton (SpaCy_Score: 0.0000, Rule_Score: 0.4000)		the mid-sixties (SpaCy_Score: 0.0000, Rule_Score: 0.4000), only a few years (SpaCy_Score: 0.0000, Rule_Score: 0.4000), 1980 (SpaCy_Score: 0.0000, Rule_Score: 0.4000), 1997 (SpaCy_Score: 0.0000, Rule_Score: 0.4000)				The Moore Building (SpaCy_Score: 0.0000, Rule_Score: 0.4000), Broughton Hospital (SpaCy_Score: 0.0000, Rule_Score: 0.4000)								3rd (SpaCy_Score: 0.0000, Rule_Score: 0.4000), 3rd (SpaCy_Score: 0.0000, Rule_Score: 0.4000), 3rd (SpaCy_Score: 0.0000, Rule_Score: 0.4000)		haunting (SpaCy_Score: 0.0000, Rule_Score: 0.9000), haunting (SpaCy_Score: 0.0000, Rule_Score: 0.9000)		Moore (Score: 0.0000)	Moore (Score: 0.4000)					Morganton (Score: 0.0000)	Morganton (Score: 0.4000)					the mid-sixties (Score: 0.0000), only a few years (Score: 0.0000), 1980 (Score: 0.0000), 1997 (Score: 0.0000)	the mid-sixties (Score: 0.4000), only a few years (Score: 0.4000), 1980 (Score: 0.4000), 1997 (Score: 0.4000)											The Moore Building (Score: 0.0000), Broughton Hospital (Score: 0.0000)	The Moore Building (Score: 0.4000), Broughton Hospital (Score: 0.4000)																							3rd (Score: 0.0000), 3rd (Score: 0.0000), 3rd (Score: 0.0000)	3rd (Score: 0.4000), 3rd (Score: 0.4000), 3rd (Score: 0.4000)					haunting (Score: 0.0000), haunting (Score: 0.0000)	haunting (Score: 0.9000), haunting (Score: 0.9000)					"[{""text"": ""The Moore Building"", ""label"": ""FAC"", ""start"": 22, ""end"": 40, ""spacy_score"": 1e-05, ""rule_score"": 0.4}, {""text"": ""haunting"", ""label"": ""GHOST_TYPE"", ""start"": 81, ""end"": 89, ""spacy_score"": 1e-05, ""rule_score"": 0.9}, {""text"": ""the mid-sixties"", ""label"": ""DATE"", ""start"": 180, ""end"": 195, ""spacy_score"": 1e-05, ""rule_score"": 0.4}, {""text"": ""only a few years"", ""label"": ""DATE"", ""start"": 361, ""end"": 377, ""spacy_score"": 1e-05, ""rule_score"": 0.4}, {""text"": ""Broughton Hospital"", ""label"": ""FAC"", ""start"": 381, ""end"": 399, ""spacy_score"": 1e-05, ""rule_score"": 0.4}, {""text"": ""Morganton"", ""label"": ""GPE"", ""start"": 403, ""end"": 412, ""spacy_score"": 1e-05, ""rule_score"": 0.4}, {""text"": ""3rd"", ""label"": ""ORDINAL"", ""start"": 418, ""end"": 421, ""spacy_score"": 1e-05, ""rule_score"": 0.4}, {""text"": ""haunting"", ""label"": ""GHOST_TYPE"", ""start"": 449, ""end"": 457, ""spacy_score"": 1e-05, ""rule_score"": 0.9}, {""text"": ""3rd"", ""label"": ""ORDINAL"", ""start"": 545, ""end"": 548, ""spacy_score"": 1e-05, ""rule_score"": 0.4}, {""text"": ""Moore"", ""label"": ""PERSON"", ""start"": 606, ""end"": 611, ""spacy_score"": 1e-05, ""rule_score"": 0.4}, {""text"": ""1980"", ""label"": ""DATE"", ""start"": 647, ""end"": 651, ""spacy_score"": 1e-05, ""rule_score"": 0.4}, {""text"": ""1997"", ""label"": ""DATE"", ""start"": 742, ""end"": 746, ""spacy_score"": 1e-05, ""rule_score"": 0.4}, {""text"": ""3rd"", ""label"": ""ORDINAL"", ""start"": 824, ""end"": 827, ""spacy_score"": 1e-05, ""rule_score"": 0.4}]"	[]
Danbury	United States	It is said that a woman who was stood up at the alter there killed herself in the church and can be seen walking around searching for her lost fiancée and the sounds of her sobbing can be heard all through the night.	Davis Chapel Church	north carolina	NC	-80.1338196	36.40674	-80.20588310000001	36.4093047	True	True	1967/02/26	wikipedia	13.2	11.533333333333331	Afternoon	Ghost Light	Murder	1967	True																																		Davis Chapel Church	36.40674	-80.1338196	original																																																																																	[]	[]
Davidson	United States	Gravity hill - Stop your car at the bottom of the hill and it is said to be that a woman will push you to the top. legend has it her car rolled over her when it broke down one night. if you put flower on the back you can see her hand prints!	Southmont	north carolina	NC	-80.26699719999999	35.6679164	-80.8486846	35.4993031	False	False	2018/02/26	wikipedia	13.35	11.533333333333331	Morning	Unknown	Unknown	2018	True	north carolina	Few Witnesses	Little Evidence	Little Evidence	Rare Events	Rare Events	Occasional Events	Moderate daylight duration	Moderate Sightings	Few Sightings	Moderate Sightings	Few Incidents	Few Incidents	Few Paranormal Incidents	Moderate Alcohol Consumption	Few Alcohol-Related Deaths	Moderate Homicide Rate	Few Reported Cases	Few Reported Cases	Few Reported Cases	Few Reported Cases	Few Reported Cases	Few Reported Cases		Moderate Air Pollution	Good Air Quality	Moderate Air Pollution	Moderate Air Pollution	Moderate Air Pollution	Good Air Quality	Stable Weather Patterns	Low Precipitation Impact	Stable Weather Patterns	Southmont	35.6679164	-80.26699719999999	original																one night (SpaCy_Score: 0.0000, Rule_Score: 0.4000)																																																		one night (Score: 0.0000)	one night (Score: 0.4000)														"[{""text"": ""one night"", ""label"": ""TIME"", ""start"": 172, ""end"": 181, ""spacy_score"": 1e-05, ""rule_score"": 0.4}]"	[]
Denton	United States	There is an old field in the woods along this road. In this field there is a house that has been abandoned for many years. The reason the house was abandoned was because many years ago there was a murder committed in it. A man came home one day and for some reason he had gone crazy. The man shot his wife outside of the house then went upstairs and shot himself. The blood was washed up outside the house and upstairs where the man committed suicide. After the blood was cleaned up it reappeared the next day and to this day it can't be cleaned. The room upstairs in the house where the man committed suicide has been blocked off so that nobody can go in and see the horrible scene. The blood outside is still there and cannot be removed. It is said that the place is haunted to this very day by those troubled souls.	Jackson Creek Road	north carolina	NC	-79.99839589999999	35.6928815	-80.1158813	35.6334712	False	False	2008/02/26	wikipedia	13.3	11.533333333333331	Morning	Mist	Murder	2008	True																																		Denton County	33.20526	-97.11697	description		House (SpaCy_Score: 0.0000, Rule_Score: 0.4000), House (SpaCy_Score: 0.0000, Rule_Score: 0.4000), House (SpaCy_Score: 0.0000, Rule_Score: 0.4000), House (SpaCy_Score: 0.0000, Rule_Score: 0.4000), House (SpaCy_Score: 0.0000, Rule_Score: 0.4000)			many years (SpaCy_Score: 0.0000, Rule_Score: 0.4000), many years ago (SpaCy_Score: 0.0000, Rule_Score: 0.4000), one day (SpaCy_Score: 0.0000, Rule_Score: 0.4000), the next day (SpaCy_Score: 0.0000, Rule_Score: 0.4000)																			House (Score: 0.0000), House (Score: 0.0000), House (Score: 0.0000), House (Score: 0.0000), House (Score: 0.0000)	House (Score: 0.4000), House (Score: 0.4000), House (Score: 0.4000), House (Score: 0.4000), House (Score: 0.4000)								many years (Score: 0.0000), many years ago (Score: 0.0000), one day (Score: 0.0000), the next day (Score: 0.0000)	many years (Score: 0.4000), many years ago (Score: 0.4000), one day (Score: 0.4000), the next day (Score: 0.4000)																																															"[{""text"": ""House"", ""label"": ""ORG"", ""start"": 77, ""end"": 82, ""spacy_score"": 1e-05, ""rule_score"": 0.4}, {""text"": ""many years"", ""label"": ""DATE"", ""start"": 111, ""end"": 121, ""spacy_score"": 1e-05, ""rule_score"": 0.4}, {""text"": ""House"", ""label"": ""ORG"", ""start"": 138, ""end"": 143, ""spacy_score"": 1e-05, ""rule_score"": 0.4}, {""text"": ""many years ago"", ""label"": ""DATE"", ""start"": 170, ""end"": 184, ""spacy_score"": 1e-05, ""rule_score"": 0.4}, {""text"": ""one day"", ""label"": ""DATE"", ""start"": 237, ""end"": 244, ""spacy_score"": 1e-05, ""rule_score"": 0.4}, {""text"": ""House"", ""label"": ""ORG"", ""start"": 321, ""end"": 326, ""spacy_score"": 1e-05, ""rule_score"": 0.4}, {""text"": ""House"", ""label"": ""ORG"", ""start"": 400, ""end"": 405, ""spacy_score"": 1e-05, ""rule_score"": 0.4}, {""text"": ""the next day"", ""label"": ""DATE"", ""start"": 497, ""end"": 509, ""spacy_score"": 1e-05, ""rule_score"": 0.4}, {""text"": ""House"", ""label"": ""ORG"", ""start"": 572, ""end"": 577, ""spacy_score"": 1e-05, ""rule_score"": 0.4}]"	[]
Dillsboro	United States	When Norfolk-Southern began expansion into the southwest mountains of North Carolina, it was difficult for the company to find men able to do the hard work required. Convicts were brought in to complete work on a tunnel right outside of Dillsboro. To get to the site, the men had to cross a section of the Tuckaseegee River on raft. One day, the raft flipped over in the rain-swollen river and all of the convicts died (except one) because they were chained together. The men were buried on the mountain above the tunnel. Sometimes, especially after a big rain, people report hearing chains rattling and the echoes of men splashing in water yelling for help. **Interesting fact about this tunnel** This is the same tunnel Harrison Ford walks into in the movie 'The Fugitive'.	GSMR Tunnel	north carolina	NC	-83.44771399999999	35.429769	-83.2523705	35.3692665	True	False	1670/02/26	wikipedia	13.316666666666666	11.533333333333331	Unknown	Unknown	Death	1670	True																																		GSMR Tunnel	35.429769	-83.44771399999999	original	Dillsboro (SpaCy_Score: 0.0000, Rule_Score: 0.4000), Harrison Ford (SpaCy_Score: 0.0000, Rule_Score: 0.4000)	Norfolk-Southern (SpaCy_Score: 0.0000, Rule_Score: 0.4000)	North Carolina (SpaCy_Score: 0.0000, Rule_Score: 0.4000)	the southwest mountains (SpaCy_Score: 0.0000, Rule_Score: 0.4000), the Tuckaseegee River (SpaCy_Score: 0.0000, Rule_Score: 0.4000)	One day (SpaCy_Score: 0.0000, Rule_Score: 0.4000)						'The Fugitive' (SpaCy_Score: 0.0000, Rule_Score: 0.4000)										Dillsboro (Score: 0.0000), Harrison Ford (Score: 0.0000)	Dillsboro (Score: 0.4000), Harrison Ford (Score: 0.4000)		Norfolk-Southern (Score: 0.0000)	Norfolk-Southern (Score: 0.4000)		North Carolina (Score: 0.0000)	North Carolina (Score: 0.4000)		the southwest mountains (Score: 0.0000), the Tuckaseegee River (Score: 0.0000)	the southwest mountains (Score: 0.4000), the Tuckaseegee River (Score: 0.4000)		One day (Score: 0.0000)	One day (Score: 0.4000)																	'The Fugitive' (Score: 0.0000)	'The Fugitive' (Score: 0.4000)																													"[{""text"": ""Norfolk-Southern"", ""label"": ""ORG"", ""start"": 5, ""end"": 21, ""spacy_score"": 1e-05, ""rule_score"": 0.4}, {""text"": ""the southwest mountains"", ""label"": ""LOC"", ""start"": 43, ""end"": 66, ""spacy_score"": 1e-05, ""rule_score"": 0.4}, {""text"": ""North Carolina"", ""label"": ""GPE"", ""start"": 70, ""end"": 84, ""spacy_score"": 1e-05, ""rule_score"": 0.4}, {""text"": ""Dillsboro"", ""label"": ""PERSON"", ""start"": 237, ""end"": 246, ""spacy_score"": 1e-05, ""rule_score"": 0.4}, {""text"": ""the Tuckaseegee River"", ""label"": ""LOC"", ""start"": 302, ""end"": 323, ""spacy_score"": 1e-05, ""rule_score"": 0.4}, {""text"": ""One day"", ""label"": ""DATE"", ""start"": 333, ""end"": 340, ""spacy_score"": 1e-05, ""rule_score"": 0.4}, {""text"": ""Harrison Ford"", ""label"": ""PERSON"", ""start"": 722, ""end"": 735, ""spacy_score"": 1e-05, ""rule_score"": 0.4}, {""text"": ""'The Fugitive'"", ""label"": ""WORK_OF_ART"", ""start"": 760, ""end"": 774, ""spacy_score"": 1e-05, ""rule_score"": 0.4}]"	[]
Dunn	United States	"near coats savage junk yard - Around 12:30pm every night when you drive by you see the ghost of a young children in the junk yard playing. And if you listen closely you can hear them saying ""ring around the rosy pocket full of posies ashes ashes we all fall dead."" Some believe its the children that died in the fetal car accident that happened back in 1967 haunt it. Some also say that they were from the devastating fire that happened back in 1934. But nobody really knows why they haunt the junkyard."	Coats	north carolina	NC	-78.6604407	35.3732414	-78.6089028	35.3062743	False	True	1967/01/01	description	13.166666666666666	11.533333333333331	Afternoon	Ghost	Death	1967	True																																		Coats	35.3732414	-78.6604407	original					1967 (SpaCy_Score: 0.0000, Rule_Score: 0.4000), 1934 (SpaCy_Score: 0.0000, Rule_Score: 0.4000)														ghost (SpaCy_Score: 0.0000, Rule_Score: 0.9000)														1967 (Score: 0.0000), 1934 (Score: 0.0000)	1967 (Score: 0.4000), 1934 (Score: 0.4000)																																									ghost (Score: 0.0000)	ghost (Score: 0.9000)					"[{""text"": ""ghost"", ""label"": ""GHOST_TYPE"", ""start"": 87, ""end"": 92, ""spacy_score"": 1e-05, ""rule_score"": 0.9}, {""text"": ""1967"", ""label"": ""DATE"", ""start"": 353, ""end"": 357, ""spacy_score"": 1e-05, ""rule_score"": 0.4}, {""text"": ""1934"", ""label"": ""DATE"", ""start"": 445, ""end"": 449, ""spacy_score"": 1e-05, ""rule_score"": 0.4}]"	[]
Dunn	United States	In about the 1820's on a Halloween day this church was having sermon and the preacher flipped out and killed every one in there and now if you go to the church and you read the big stone memorial and walk up to the doors and read the sign and do what it tells you to than you will see a man holding a lantern and he will wave you on.	Old Bluff Church	north carolina	NC	-78.734095	35.1621189	-78.6089028	35.3062743	False	False	2025/10/31	wikipedia	13.25	11.533333333333331	Morning	Unknown	Murder	2025	True																																		Old Bluff Church	35.1621189	-78.734095	original					1820 (SpaCy_Score: 0.0000, Rule_Score: 0.4000), Halloween day (SpaCy_Score: 0.0000, Rule_Score: 0.4000)																												1820 (Score: 0.0000), Halloween day (Score: 0.0000)	1820 (Score: 0.4000), Halloween day (Score: 0.4000)																																															"[{""text"": ""1820"", ""label"": ""DATE"", ""start"": 13, ""end"": 17, ""spacy_score"": 1e-05, ""rule_score"": 0.4}, {""text"": ""Halloween day"", ""label"": ""DATE"", ""start"": 25, ""end"": 38, ""spacy_score"": 1e-05, ""rule_score"": 0.4}]"	[]
