Asheville	United States	Back in 1914, George W. Vanderbilt died from complications from a surgery he had for appendicitis. His wife was extremely upset. So late at nights, in the Library, she would sit in front of the large marble fireplace, and talk with George. Though he was never really there. Her servants started to think she was losing her mind. To this day late at night you can still hear her voice very softly talking with George. Also, You can feel George's presence in the Billiard Room, and the 2nd floor Oak Sitting room. One of his favorite rooms in the mansion. During rainy late nights, George would sit and read. Workers report feelings of being watched, apparitions, voices, laughing, & screams. A headless orange cat has been seen by numerous visitors roaming the area between the Gardens and the Bass pond. The Pool Room is also a focal point of unexplainable events. The sound of people swimming echoes throughout the entire lower floor in the dead of night. Insane laughter can be heard coming from the drain at the bottom of the pool. It is said to be haunted by a lady in black. Employees report hearing footsteps on the second floor. Its $10 for the small tour and $50 for the full tour of the house. But be sure you stay CLOSE to the guide. Odds are, there will only be 3 or 4 people touring with you.	The Biltmore Estate	north carolina	NC	-82.5523204	35.5405665	-82.5514869	35.5950581	True	True	1914/01/01	description	13.116666666666667	11.533333333333331	Morning	Unknown	Death	1914	True																																		The Biltmore Estate	35.5405665	-82.5523204	original	George W. Vanderbilt (SpaCy_Score: 0.0000, Rule_Score: 0.4000), George (SpaCy_Score: 0.0000, Rule_Score: 0.4000), George (SpaCy_Score: 0.0000, Rule_Score: 0.4000), George (SpaCy_Score: 0.0000, Rule_Score: 0.4000), George (SpaCy_Score: 0.0000, Rule_Score: 0.4000), Bass (SpaCy_Score: 0.0000, Rule_Score: 0.4000)	House (SpaCy_Score: 0.0000, Rule_Score: 0.4000)		the Billiard Room (SpaCy_Score: 0.0000, Rule_Score: 0.4000), the Gardens (SpaCy_Score: 0.0000, Rule_Score: 0.4000)	1914 (SpaCy_Score: 0.0000, Rule_Score: 0.4000)				Oak Sitting (SpaCy_Score: 0.0000, Rule_Score: 0.4000), The Pool Room (SpaCy_Score: 0.0000, Rule_Score: 0.4000)				10 (SpaCy_Score: 0.0000, Rule_Score: 0.4000), 50 (SpaCy_Score: 0.0000, Rule_Score: 0.4000)			late nights (SpaCy_Score: 0.0000, Rule_Score: 0.4000), night (SpaCy_Score: 0.0000, Rule_Score: 0.4000)	2nd (SpaCy_Score: 0.0000, Rule_Score: 0.4000), second (SpaCy_Score: 0.0000, Rule_Score: 0.4000)	One (SpaCy_Score: 0.0000, Rule_Score: 0.4000), 3 (SpaCy_Score: 0.0000, Rule_Score: 0.4000), 4 (SpaCy_Score: 0.0000, Rule_Score: 0.4000)			George W. Vanderbilt (Score: 0.0000), George (Score: 0.0000), George (Score: 0.0000), George (Score: 0.0000), George (Score: 0.0000), Bass (Score: 0.0000)	George W. Vanderbilt (Score: 0.4000), George (Score: 0.4000), George (Score: 0.4000), George (Score: 0.4000), George (Score: 0.4000), Bass (Score: 0.4000)		House (Score: 0.0000)	House (Score: 0.4000)					the Billiard Room (Score: 0.0000), the Gardens (Score: 0.0000)	the Billiard Room (Score: 0.4000), the Gardens (Score: 0.4000)		1914 (Score: 0.0000)	1914 (Score: 0.4000)											Oak Sitting (Score: 0.0000), The Pool Room (Score: 0.0000)	Oak Sitting (Score: 0.4000), The Pool Room (Score: 0.4000)											10 (Score: 0.0000), 50 (Score: 0.0000)	10 (Score: 0.4000), 50 (Score: 0.4000)								late nights (Score: 0.0000), night (Score: 0.0000)	late nights (Score: 0.4000), night (Score: 0.4000)		2nd (Score: 0.0000), second (Score: 0.0000)	2nd (Score: 0.4000), second (Score: 0.4000)		One (Score: 0.0000), 3 (Score: 0.0000), 4 (Score: 0.0000)	One (Score: 0.4000), 3 (Score: 0.4000), 4 (Score: 0.4000)								"[{""text"": ""1914"", ""label"": ""DATE"", ""start"": 8, ""end"": 12, ""spacy_score"": 1e-05, ""rule_score"": 0.4}, {""text"": ""George W. Vanderbilt"", ""label"": ""PERSON"", ""start"": 14, ""end"": 34, ""spacy_score"": 1e-05, ""rule_score"": 0.4}, {""text"": ""George"", ""label"": ""PERSON"", ""start"": 232, ""end"": 238, ""spacy_score"": 1e-05, ""rule_score"": 0.4}, {""text"": ""George"", ""label"": ""PERSON"", ""start"": 409, ""end"": 415, ""spacy_score"": 1e-05, ""rule_score"": 0.4}, {""text"": ""George"", ""label"": ""PERSON"", ""start"": 436, ""end"": 442, ""spacy_score"": 1e-05, ""rule_score"": 0.4}, {""text"": ""the Billiard Room"", ""label"": ""LOC"", ""start"": 457, ""end"": 474, ""spacy_score"": 1e-05, ""rule_score"": 0.4}, {""text"": ""2nd"", ""label"": ""ORDINAL"", ""start"": 484, ""end"": 487, ""spacy_score"": 1e-05, ""rule_score"": 0.4}, {""text"": ""Oak Sitting"", ""label"": ""FAC"", ""start"": 494, ""end"": 505, ""spacy_score"": 1e-05, ""rule_score"": 0.4}, {""text"": ""One"", ""label"": ""CARDINAL"", ""start"": 512, ""end"": 515, ""spacy_score"": 1e-05, ""rule_score"": 0.4}, {""text"": ""late nights"", ""label"": ""TIME"", ""start"": 567, ""end"": 578, ""spacy_score"": 1e-05, ""rule_score"": 0.4}, {""text"": ""George"", ""label"": ""PERSON"", ""start"": 580, ""end"": 586, ""spacy_score"": 1e-05, ""rule_score"": 0.4}, {""text"": ""the Gardens"", ""label"": ""LOC"", ""start"": 773, ""end"": 784, ""spacy_score"": 1e-05, ""rule_score"": 0.4}, {""text"": ""Bass"", ""label"": ""PERSON"", ""start"": 793, ""end"": 797, ""spacy_score"": 1e-05, ""rule_score"": 0.4}, {""text"": ""The Pool Room"", ""label"": ""FAC"", ""start"": 804, ""end"": 817, ""spacy_score"": 1e-05, ""rule_score"": 0.4}, {""text"": ""night"", ""label"": ""TIME"", ""start"": 950, ""end"": 955, ""spacy_score"": 1e-05, ""rule_score"": 0.4}, {""text"": ""second"", ""label"": ""ORDINAL"", ""start"": 1122, ""end"": 1128, ""spacy_score"": 1e-05, ""rule_score"": 0.4}, {""text"": ""10"", ""label"": ""MONEY"", ""start"": 1141, ""end"": 1143, ""spacy_score"": 1e-05, ""rule_score"": 0.4}, {""text"": ""50"", ""label"": ""MONEY"", ""start"": 1168, ""end"": 1170, ""spacy_score"": 1e-05, ""rule_score"": 0.4}, {""text"": ""House"", ""label"": ""ORG"", ""start"": 1196, ""end"": 1201, ""spacy_score"": 1e-05, ""rule_score"": 0.4}, {""text"": ""3"", ""label"": ""CARDINAL"", ""start"": 1273, ""end"": 1274, ""spacy_score"": 1e-05, ""rule_score"": 0.4}, {""text"": ""4"", ""label"": ""CARDINAL"", ""start"": 1278, ""end"": 1279, ""spacy_score"": 1e-05, ""rule_score"": 0.4}]"	[]
Asheville	United States	"The legendary ghost of Dr. Jamie Smith, who lived at this infamous Asheville locale known as ""Chicken Alley"" over a century ago. For decades, countless sightings of his ghost have been reported. Dr. Smith was killed in a bar-room confrontation in 1902 at the old historic ""Broadway's Tavern"" The tavern was destroyed by fire the following year. The close vicinity known as Chicken Alley has been victim to his ghost for over one hundred years!"	Chicken Alley	north carolina	NC	-82.55320929999999	35.5977813	-82.5514869	35.5950581	False	True	1902/01/01	description	13.083333333333334	11.533333333333331	Morning	Ghost	Murder	1902	True																																		Asheville	35.60095	-82.55402	description	Jamie Smith (SpaCy_Score: 0.0000, Rule_Score: 0.4000), Smith (SpaCy_Score: 0.0000, Rule_Score: 0.4000)	Chicken Alley (SpaCy_Score: 0.0000, Rule_Score: 0.4000)	Asheville (SpaCy_Score: 0.0000, Rule_Score: 0.4000)		a century ago (SpaCy_Score: 0.0000, Rule_Score: 0.4000), decades (SpaCy_Score: 0.0000, Rule_Score: 0.4000), 1902 (SpaCy_Score: 0.0000, Rule_Score: 0.4000), the following year (SpaCy_Score: 0.0000, Rule_Score: 0.4000)						Chicken Alley (SpaCy_Score: 0.0000, Rule_Score: 0.4000), Broadway's Tavern (SpaCy_Score: 0.0000, Rule_Score: 0.4000)								ghost (SpaCy_Score: 0.0000, Rule_Score: 0.9000), ghost (SpaCy_Score: 0.0000, Rule_Score: 0.9000), ghost (SpaCy_Score: 0.0000, Rule_Score: 0.9000)		Jamie Smith (Score: 0.0000), Smith (Score: 0.0000)	Jamie Smith (Score: 0.4000), Smith (Score: 0.4000)		Chicken Alley (Score: 0.0000)	Chicken Alley (Score: 0.4000)		Asheville (Score: 0.0000)	Asheville (Score: 0.4000)					a century ago (Score: 0.0000), decades (Score: 0.0000), 1902 (Score: 0.0000), the following year (Score: 0.0000)	a century ago (Score: 0.4000), decades (Score: 0.4000), 1902 (Score: 0.4000), the following year (Score: 0.4000)																	Chicken Alley (Score: 0.0000), Broadway's Tavern (Score: 0.0000)	Chicken Alley (Score: 0.4000), Broadway's Tavern (Score: 0.4000)																							ghost (Score: 0.0000), ghost (Score: 0.0000), ghost (Score: 0.0000)	ghost (Score: 0.9000), ghost (Score: 0.9000), ghost (Score: 0.9000)					"[{""text"": ""ghost"", ""label"": ""GHOST_TYPE"", ""start"": 14, ""end"": 19, ""spacy_score"": 1e-05, ""rule_score"": 0.9}, {""text"": ""Jamie Smith"", ""label"": ""PERSON"", ""start"": 27, ""end"": 38, ""spacy_score"": 1e-05, ""rule_score"": 0.4}, {""text"": ""Asheville"", ""label"": ""GPE"", ""start"": 67, ""end"": 76, ""spacy_score"": 1e-05, ""rule_score"": 0.4}, {""text"": ""Chicken Alley"", ""label"": ""WORK_OF_ART"", ""start"": 94, ""end"": 107, ""spacy_score"": 1e-05, ""rule_score"": 0.4}, {""text"": ""a century ago"", ""label"": ""DATE"", ""start"": 114, ""end"": 127, ""spacy_score"": 1e-05, ""rule_score"": 0.4}, {""text"": ""decades"", ""label"": ""DATE"", ""start"": 133, ""end"": 140, ""spacy_score"": 1e-05, ""rule_score"": 0.4}, {""text"": ""ghost"", ""label"": ""GHOST_TYPE"", ""start"": 169, ""end"": 174, ""spacy_score"": 1e-05, ""rule_score"": 0.9}, {""text"": ""Smith"", ""label"": ""PERSON"", ""start"": 199, ""end"": 204, ""spacy_score"": 1e-05, ""rule_score"": 0.4}, {""text"": ""1902"", ""label"": ""DATE"", ""start"": 247, ""end"": 251, ""spacy_score"": 1e-05, ""rule_score"": 0.4}, {""text"": ""Broadway's Tavern"", ""label"": ""WORK_OF_ART"", ""start"": 273, ""end"": 290, ""spacy_score"": 1e-05, ""rule_score"": 0.4}, {""text"": ""the following year"", ""label"": ""DATE"", ""start"": 325, ""end"": 343, ""spacy_score"": 1e-05, ""rule_score"": 0.4}, {""text"": ""Chicken Alley"", ""label"": ""ORG"", ""start"": 373, ""end"": 386, ""spacy_score"": 1e-05, ""rule_score"": 0.4}, {""text"": ""ghost"", ""label"": ""GHOST_TYPE"", ""start"": 410, ""end"": 415, ""spacy_score"": 1e-05, ""rule_score"": 0.9}]"	[]
Asheville	United States	Potter’s Field - In the nineteen-seventies when the new Clyde Erwin High school was built just outside Asheville, the remnants of what was called the Old County Home Graveyard was dug up to make room for the new building. Numerous transients & casualties of sickness who were buried here were moved across the street and planted below unmarked wooden crosses. It's said that the restless spirits of those buried here still haunt the school, and many janitors who have worked the night shift there refuse to recount the things they've experienced while inside. Unmarked graves are said to still lie beneath the potter's field, overlooking the school.	Erwin High school	north carolina	NC	-82.6263124	35.6193959	-82.5514869	35.5950581	False	True	2001/02/26	wikipedia	13.116666666666667	11.533333333333331	Afternoon	Unknown	Unknown	2001	True																																		Asheville	35.60095	-82.55402	description	Potter (SpaCy_Score: 0.0000, Rule_Score: 0.4000), Clyde Erwin (SpaCy_Score: 0.0000, Rule_Score: 0.4000)	the Old County Home Graveyard (SpaCy_Score: 0.0000, Rule_Score: 0.4000)	Asheville (SpaCy_Score: 0.0000, Rule_Score: 0.4000)		nineteen-seventies (SpaCy_Score: 0.0000, Rule_Score: 0.4000)																Potter (Score: 0.0000), Clyde Erwin (Score: 0.0000)	Potter (Score: 0.4000), Clyde Erwin (Score: 0.4000)		the Old County Home Graveyard (Score: 0.0000)	the Old County Home Graveyard (Score: 0.4000)		Asheville (Score: 0.0000)	Asheville (Score: 0.4000)					nineteen-seventies (Score: 0.0000)	nineteen-seventies (Score: 0.4000)																																															"[{""text"": ""Potter"", ""label"": ""PERSON"", ""start"": 0, ""end"": 6, ""spacy_score"": 1e-05, ""rule_score"": 0.4}, {""text"": ""nineteen-seventies"", ""label"": ""DATE"", ""start"": 24, ""end"": 42, ""spacy_score"": 1e-05, ""rule_score"": 0.4}, {""text"": ""Clyde Erwin"", ""label"": ""PERSON"", ""start"": 56, ""end"": 67, ""spacy_score"": 1e-05, ""rule_score"": 0.4}, {""text"": ""Asheville"", ""label"": ""GPE"", ""start"": 103, ""end"": 112, ""spacy_score"": 1e-05, ""rule_score"": 0.4}, {""text"": ""the Old County Home Graveyard"", ""label"": ""ORG"", ""start"": 146, ""end"": 175, ""spacy_score"": 1e-05, ""rule_score"": 0.4}]"	[]
Asheville	United States	There is a lady dressed in pink that haunts this Inn. You can see her and hear her late at night. Several guests and employees have had several encounters with her. She is known to tickle toes at night while visitors are attempting to sleep. She is said to be the wife of the famous writer Fitzgerald. When you get close to room 545, it seems to get cold. You can usually here doors slamming, laughter, and talking from rooms that are not used.	The Grove Park Inn	north carolina	NC	-82.542868	35.620178	-82.5514869	35.5950581	True	False	2008/02/26	wikipedia	13.116666666666667	11.533333333333331	Afternoon	Ghost Light	Supernatural Phenomenon	2008	True																																		Holland Grove Park	1.31361	103.78028	description	Fitzgerald (SpaCy_Score: 0.0000, Rule_Score: 0.4000)															night (SpaCy_Score: 0.0000, Rule_Score: 0.4000)		545 (SpaCy_Score: 0.0000, Rule_Score: 0.4000)			Fitzgerald (Score: 0.0000)	Fitzgerald (Score: 0.4000)																																												night (Score: 0.0000)	night (Score: 0.4000)					545 (Score: 0.0000)	545 (Score: 0.4000)								"[{""text"": ""night"", ""label"": ""TIME"", ""start"": 196, ""end"": 201, ""spacy_score"": 1e-05, ""rule_score"": 0.4}, {""text"": ""Fitzgerald"", ""label"": ""PERSON"", ""start"": 290, ""end"": 300, ""spacy_score"": 1e-05, ""rule_score"": 0.4}, {""text"": ""545"", ""label"": ""CARDINAL"", ""start"": 329, ""end"": 332, ""spacy_score"": 1e-05, ""rule_score"": 0.4}]"	[]
Asheville	United States	recently torn down and rebuilt - When the Zalandia Castle caught fire; a woman named Helen lost her only child. A daughter. Helen was so crushed by the loss she hung herself from the bridge right down the road from the castle. On Halloween night go to the bridge and try to conjure Helen. If she is successfully called, you car will mess up in some way that you can't get down the mountain.	Helens' Bridge	north carolina	NC	-82.53812789999999	35.5954703	-82.5514869	35.5950581	False	False	1980/05/18	wikipedia	13.116666666666667	11.533333333333331	Afternoon	Unknown	Natural Disaster	1980	False																																		Helens' Bridge	35.5954703	-82.53812789999999	original	Helen (SpaCy_Score: 0.0000, Rule_Score: 0.4000), Helen (SpaCy_Score: 0.0000, Rule_Score: 0.4000), Helen (SpaCy_Score: 0.0000, Rule_Score: 0.4000)															Halloween night (SpaCy_Score: 0.0000, Rule_Score: 0.4000)				castle (SpaCy_Score: 0.0000, Rule_Score: 0.9000)	Helen (Score: 0.0000), Helen (Score: 0.0000), Helen (Score: 0.0000)	Helen (Score: 0.4000), Helen (Score: 0.4000), Helen (Score: 0.4000)																																												Halloween night (Score: 0.0000)	Halloween night (Score: 0.4000)											castle (Score: 0.0000)	castle (Score: 0.9000)		"[{""text"": ""Helen"", ""label"": ""PERSON"", ""start"": 85, ""end"": 90, ""spacy_score"": 1e-05, ""rule_score"": 0.4}, {""text"": ""Helen"", ""label"": ""PERSON"", ""start"": 124, ""end"": 129, ""spacy_score"": 1e-05, ""rule_score"": 0.4}, {""text"": ""castle"", ""label"": ""HAUNTED_LOCATION"", ""start"": 219, ""end"": 225, ""spacy_score"": 1e-05, ""rule_score"": 0.9}, {""text"": ""Halloween night"", ""label"": ""TIME"", ""start"": 230, ""end"": 245, ""spacy_score"": 1e-05, ""rule_score"": 0.4}, {""text"": ""Helen"", ""label"": ""PERSON"", ""start"": 282, ""end"": 287, ""spacy_score"": 1e-05, ""rule_score"": 0.4}]"	[]
Asheville	United States	It is said to be haunted by a servant when the building was home to Dr. Samuel Westray Battle. The ghost's name is Alice and is said to walk around the building and play with the TV equipment. She is said to be also the Pink Lady, because The Battle mansion is next to the Grove Park Inn, and she has been seen walking over to the Inn.	home to Channel 13 WLOS	north carolina	NC	-82.558104	35.488059	-82.5514869	35.5950581	False	True	1993/07/06	wikipedia	13.116666666666667	11.533333333333331	Afternoon	Unknown	Supernatural Phenomenon	1993	True																																		Grove Park	51.43591	0.02327	description	Samuel Westray (SpaCy_Score: 0.0000, Rule_Score: 0.4000), Alice (SpaCy_Score: 0.0000, Rule_Score: 0.4000), Battle (SpaCy_Score: 0.0000, Rule_Score: 0.4000)		Inn (SpaCy_Score: 0.0000, Rule_Score: 0.4000)						the Grove Park Inn (SpaCy_Score: 0.0000, Rule_Score: 0.4000)										ghost (SpaCy_Score: 0.0000, Rule_Score: 0.9000)		Samuel Westray (Score: 0.0000), Alice (Score: 0.0000), Battle (Score: 0.0000)	Samuel Westray (Score: 0.4000), Alice (Score: 0.4000), Battle (Score: 0.4000)					Inn (Score: 0.0000)	Inn (Score: 0.4000)																	the Grove Park Inn (Score: 0.0000)	the Grove Park Inn (Score: 0.4000)																													ghost (Score: 0.0000)	ghost (Score: 0.9000)					"[{""text"": ""Samuel Westray"", ""label"": ""PERSON"", ""start"": 72, ""end"": 86, ""spacy_score"": 1e-05, ""rule_score"": 0.4}, {""text"": ""ghost"", ""label"": ""GHOST_TYPE"", ""start"": 99, ""end"": 104, ""spacy_score"": 1e-05, ""rule_score"": 0.9}, {""text"": ""Alice"", ""label"": ""PERSON"", ""start"": 115, ""end"": 120, ""spacy_score"": 1e-05, ""rule_score"": 0.4}, {""text"": ""Battle"", ""label"": ""PERSON"", ""start"": 243, ""end"": 249, ""spacy_score"": 1e-05, ""rule_score"": 0.4}, {""text"": ""the Grove Park Inn"", ""label"": ""FAC"", ""start"": 269, ""end"": 287, ""spacy_score"": 1e-05, ""rule_score"": 0.4}, {""text"": ""Inn"", ""label"": ""GPE"", ""start"": 331, ""end"": 334, ""spacy_score"": 1e-05, ""rule_score"": 0.4}]"	[]
Asheville	United States	You can see a face in one of the top windows, thought to be the face of a man who committed suicide after loosing everything during the great depression.	Jackson Building	north carolina	NC	-82.5136381	35.4668883	-82.5514869	35.5950581	False	False	1520/02/26	wikipedia	13.116666666666667	11.533333333333331	Morning	Mist	Unknown	1520	True																																		Jackson Building	35.4668883	-82.5136381	original																		one (SpaCy_Score: 0.0000, Rule_Score: 0.4000)																																																						one (Score: 0.0000)	one (Score: 0.4000)								"[{""text"": ""one"", ""label"": ""CARDINAL"", ""start"": 22, ""end"": 25, ""spacy_score"": 1e-05, ""rule_score"": 0.4}]"	[]
Asheville	United States	It's said that in a private apartment building in downtown Asheville which used to be known as the Battery Park Hotel in the early to mid 1900's, apparitions can be seen very early in the morning. Individuals who worked the morning shift in the pantry refused to go in alone because a man who was murdered there was known to reveal himself in spirit form to employees.	Old Battery Park Hotel	north carolina	NC	-82.55493609999999	35.5955297	-82.5514869	35.5950581	False	True	2010/02/26	wikipedia	13.05	11.533333333333331	Morning	Ghost	Unknown	2010	True																																		Asheville	35.60095	-82.55402	description		the Battery Park Hotel (SpaCy_Score: 0.0000, Rule_Score: 0.4000)	Asheville (SpaCy_Score: 0.0000, Rule_Score: 0.4000)		the early to mid 1900's (SpaCy_Score: 0.0000, Rule_Score: 0.4000)											early in the morning (SpaCy_Score: 0.0000, Rule_Score: 0.4000), morning (SpaCy_Score: 0.0000, Rule_Score: 0.4000)			spirit (SpaCy_Score: 0.0000, Rule_Score: 0.9000)					the Battery Park Hotel (Score: 0.0000)	the Battery Park Hotel (Score: 0.4000)		Asheville (Score: 0.0000)	Asheville (Score: 0.4000)					the early to mid 1900's (Score: 0.0000)	the early to mid 1900's (Score: 0.4000)																																early in the morning (Score: 0.0000), morning (Score: 0.0000)	early in the morning (Score: 0.4000), morning (Score: 0.4000)								spirit (Score: 0.0000)	spirit (Score: 0.9000)					"[{""text"": ""Asheville"", ""label"": ""GPE"", ""start"": 59, ""end"": 68, ""spacy_score"": 1e-05, ""rule_score"": 0.4}, {""text"": ""the Battery Park Hotel"", ""label"": ""ORG"", ""start"": 95, ""end"": 117, ""spacy_score"": 1e-05, ""rule_score"": 0.4}, {""text"": ""the early to mid 1900's"", ""label"": ""DATE"", ""start"": 121, ""end"": 144, ""spacy_score"": 1e-05, ""rule_score"": 0.4}, {""text"": ""early in the morning"", ""label"": ""TIME"", ""start"": 175, ""end"": 195, ""spacy_score"": 1e-05, ""rule_score"": 0.4}, {""text"": ""morning"", ""label"": ""TIME"", ""start"": 224, ""end"": 231, ""spacy_score"": 1e-05, ""rule_score"": 0.4}, {""text"": ""spirit"", ""label"": ""GHOST_TYPE"", ""start"": 343, ""end"": 349, ""spacy_score"": 1e-05, ""rule_score"": 0.9}]"	[]
Asheville	United States	the sounds of pool being played can be heard.	Reed House	north carolina	NC	-82.5394027	35.5642357	-82.5514869	35.5950581	True	False	1630/02/26	wikipedia	13.0	11.533333333333331	Afternoon	Unknown	Unknown	1630	False																																		Reed House	35.5642357	-82.5394027	original																																																																																	[]	[]
Asheville	United States	"Abandoned Forestry Compound - There is a building in the compound which has all the windows boarded up. The downstairs consists of a long dark hallway with doors alternating on either side. In one downstairs bathroom there is a toilet filled with blood. Upstairs there is a room used by a now dead prostitute. This building is nicknamed the ""Whorehouse"" for that reason. Even when the temperature outside is 70 degrees, it barely reaches 40 degrees inside. Strange noises are heard by people who live in the Shiloh neighborhood, and lights have been seen as well. There are other buildings in the compound, and their doors are open and closed at random. There is a length of rope hanging from the rafters in one building."	Shiloh	north carolina	NC	-82.53075919999999	35.5489888	-82.5514869	35.5950581	True	True	2008/02/26	wikipedia	13.066666666666666	11.533333333333331	Afternoon	Unknown	Murder	2008	True																																		Shiloh	35.5489888	-82.53075919999999	original				Shiloh (SpaCy_Score: 0.0000, Rule_Score: 0.4000)							"the ""Whorehouse (SpaCy_Score: 0.0000, Rule_Score: 0.4000)"				70 degrees (SpaCy_Score: 0.0000, Rule_Score: 0.4000), 40 degrees (SpaCy_Score: 0.0000, Rule_Score: 0.4000)			one (SpaCy_Score: 0.0000, Rule_Score: 0.4000), one (SpaCy_Score: 0.0000, Rule_Score: 0.4000)												Shiloh (Score: 0.0000)	Shiloh (Score: 0.4000)																				"the ""Whorehouse (Score: 0.0000)"	"the ""Whorehouse (Score: 0.4000)"											70 degrees (Score: 0.0000), 40 degrees (Score: 0.0000)	70 degrees (Score: 0.4000), 40 degrees (Score: 0.4000)								one (Score: 0.0000), one (Score: 0.0000)	one (Score: 0.4000), one (Score: 0.4000)								"[{""text"": ""one"", ""label"": ""CARDINAL"", ""start"": 193, ""end"": 196, ""spacy_score"": 1e-05, ""rule_score"": 0.4}, {""text"": ""the \""Whorehouse"", ""label"": ""WORK_OF_ART"", ""start"": 337, ""end"": 352, ""spacy_score"": 1e-05, ""rule_score"": 0.4}, {""text"": ""70 degrees"", ""label"": ""QUANTITY"", ""start"": 408, ""end"": 418, ""spacy_score"": 1e-05, ""rule_score"": 0.4}, {""text"": ""40 degrees"", ""label"": ""QUANTITY"", ""start"": 438, ""end"": 448, ""spacy_score"": 1e-05, ""rule_score"": 0.4}, {""text"": ""Shiloh"", ""label"": ""LOC"", ""start"": 508, ""end"": 514, ""spacy_score"": 1e-05, ""rule_score"": 0.4}, {""text"": ""one"", ""label"": ""CARDINAL"", ""start"": 708, ""end"": 711, ""spacy_score"": 1e-05, ""rule_score"": 0.4}]"	[]
Atlantic Beach	United States	There is said to believe that civil war ghosts haunt the top of the fort and watch for the union soldiers to attack. And there have been accounts on which during World War 2 the main gate was closed on it own while the guards were keeping watch on the place.	Fort Macon	north carolina	NC	-76.67866939999999	34.69714039999999	-76.7402108	34.6990505	False	True	2008/02/26	wikipedia	13.083333333333334	11.533333333333331	Afternoon	Ghost	War	2008	True																																		Fort Macon State Park	34.69572	-76.68854	description			fort (SpaCy_Score: 0.0000, Rule_Score: 0.4000)					World War 2 (SpaCy_Score: 0.0000, Rule_Score: 0.4000)																			fort (Score: 0.0000)	fort (Score: 0.4000)														World War 2 (Score: 0.0000)	World War 2 (Score: 0.4000)																																						"[{""text"": ""fort"", ""label"": ""GPE"", ""start"": 68, ""end"": 72, ""spacy_score"": 1e-05, ""rule_score"": 0.4}, {""text"": ""World War 2"", ""label"": ""EVENT"", ""start"": 162, ""end"": 173, ""spacy_score"": 1e-05, ""rule_score"": 0.4}]"	[]
